{
  "$schema": "http://json-schema.org/draft-07/schema#",
  "$id": "https://alebrije.io/schemas/envelope.v1.json",
  "title": "Alebrije Event Envelope v1",
  "description": "Base envelope shared by every event that travels the Alebrije EventBus. Per-event schemas use allOf + $ref to inherit these fields and constrain event_type + data.",
  "type": "object",
  "required": [
    "event_id",
    "event_type",
    "event_version",
    "tenant_id",
    "timestamp",
    "producer",
    "data"
  ],
  "properties": {
    "event_id": {
      "type": "string",
      "format": "uuid",
      "description": "UUID (preferably v7) uniquely identifying this event. Used for dedupe."
    },
    "event_type": {
      "type": "string",
      "pattern": "^[a-z_]+\\.[a-z_]+(\\.[a-z_]+)?$",
      "description": "Canonical <domain>.<entity>.<action> identifier (past-tense verb). The 3-segment shape is the ADR-31 default for NEW event types. A 2-segment <domain>.<action> shape is also accepted: some real producers (see rewards.earned.v1.json / rewards.redeemed.v1.json, DEBT-AUDIT-20260701-019-rewards) stamp a literal 2-segment event_type onto events that DO travel through the enveloped outbox pipeline (alebrije-common-go outbox.Poller.buildEnvelope stamps row.EventType verbatim, with no reformatting), so the envelope regex must admit that real wire value rather than reject every event of that type. Relaxing an existing constraint is additive per README.md section 6 (no version bump)."
    },
    "event_version": {
      "type": "string",
      "pattern": "^\\d+\\.\\d+$",
      "description": "Schema version (major.minor) matching the .vN file suffix."
    },
    "tenant_id": {
      "type": "string",
      "format": "uuid",
      "description": "Tenant that owns this event. Present in every event without exception (ADR-25)."
    },
    "context_id": {
      "type": ["string", "null"],
      "maxLength": 36,
      "description": "Optional multi-context selector (ADR-25)."
    },
    "external_ref": {
      "type": ["string", "null"],
      "description": "Correlation ID for callback events. Required in notifications.*.delivered and other callback events where the caller must echo the reference it sent on the original request."
    },
    "sender_type": {
      "type": ["string", "null"],
      "enum": ["client", "employee", "tenant_admin", null],
      "description": "Identity class of the party that originated the interaction (AQ-112). Resolved from the conversation in WhatsApp-origin producers (sender_type column on omnichannel.conversations). Nullable + optional for backward compatibility: events emitted before AQ-112, or where identity is not yet resolved, omit it."
    },
    "branch_id": {
      "type": ["string", "null"],
      "maxLength": 36,
      "description": "Multi-context selector for the originating branch (AQ-112). Maps to context_id on omnichannel.conversations. Nullable + optional for backward compatibility; distinct from the envelope-level context_id which is the routing context."
    },
    "timestamp": {
      "type": "string",
      "format": "date-time",
      "description": "ISO 8601 UTC timestamp at which the event occurred (producer clock)."
    },
    "producer": {
      "type": "object",
      "required": ["service"],
      "properties": {
        "service": {
          "type": "string",
          "description": "Deployment name of the emitting service (e.g. alebrije-mod-rewards-go)."
        },
        "version": {
          "type": "string",
          "description": "Image tag / app version of the emitting service. Optional: alebrije-common-go's outbox.Poller.buildEnvelope() relays outbox rows on behalf of the original producer and structurally cannot know the producer's build version (poller.go's own comment: 'Fields the poller cannot know (producer.version, context_id, trace_id) are intentionally omitted'), so it stamps only {\"service\": \"outbox-poller\"}. Making version required made every outbox-relayed event (e.g. rewards.earned, rewards.redeemed, rewards.fraud.flagged) unsatisfiable-by-construction, DEBT-AUDIT-20260701-019-rewards. Relaxing an existing constraint is additive per README.md section 6 (no version bump)."
        }
      }
    },
    "trace_id": {
      "type": ["string", "null"],
      "description": "OpenTelemetry trace id for cross-service correlation (32 hex chars)."
    },
    "data": {
      "type": "object",
      "description": "Per-event payload. Shape is defined by the per-event schema that refs this envelope."
    }
  }
}
